{
  "feature_version": "v2",
  "window_start": "2026-03-24T10:00:00Z",
  "window_end": "2026-03-24T10:01:00Z",
  "entity": {
    "endpoint": "/api/v1/orders"
  },
  "features": {
    "request_count": 120,
    "avg_latency_ms": 420,
    "p95_latency_ms": 1800,
    "p99_latency_ms": 3200,
    "status_5xx_ratio": 0.12,
    "baseline_avg_latency_ms": 180,
    "baseline_5xx_ratio": 0.01
  }
}
